id,title,body_html,vendor,product_type,created_at,handle,updated_at,published_at,template_suffix,published_scope,tags,status,admin_graphql_api_id,variants,options,images,image
9723741536597,CONVERSE | CHUCK TAYLOR ALL STAR LO,"The Converse Chuck Taylor All Star II Lo sneaker. Retaining the revolutionary silhouette we all rely on, but now made even better. New features include Lunarlon sockliner, adding cushioning and arch support. Micro-suede lining, premium canvas construction and a padded, non-slip tongue deliver superior comfort and durability. Moulded eyelets add a premium touch. The embossed, screen-printed license plate and embroidered, star-centered ankle patch add striking depth and dimension to recognizable, classic details.",CONVERSE,SHOES,2024-12-19T09:27:46-05:00,converse-chuck-taylor-all-star-lo,2024-12-19T09:35:54-05:00,2024-12-19T09:27:46-05:00,,web,"converse, egnition-sample-data, men, summer",active,gid://shopify/Product/9723741536597,"[variant(50041516884309), variant(50041516917077), variant(50041516982613), variant(50041517015381), variant(50041517080917), variant(50041517113685), variant(50041517146453), variant(50041517211989), variant(50041517244757), variant(50041517277525), variant(50041517343061)]","[option(12198238093653), option(12198238126421)]","[image(57004524437845), image(57004524470613), image(57004524765525), image(57004525027669), image(57004525060437)]",image(57004524437845)
9723741634901,CONVERSE | CHUCK TAYLOR ALL STAR II HI,"Introducing the Converse Chuck Taylor All Star II Hi sneaker. Retaining the revolutionary silhouette we all rely on, but now made ever better. New features include Lunarlon sockliner adds cushioning and arch support. Micro-suede lining, premium textured shield canvas construction and a padded, non-slip tongue deliver superior comfort and durability. Moulded eyelets add a premium touch. The embossed, screen-printed license plate and embroidered, star-centered ankle patch add striking depth and dimension to recognizable, classic details.",CONVERSE,SHOES,2024-12-19T09:27:49-05:00,converse-chuck-taylor-all-star-ii-hi,2024-12-19T09:35:54-05:00,2024-12-19T09:27:49-05:00,,web,"converse, egnition-sample-data, men, summer",active,gid://shopify/Product/9723741634901,"[variant(50041518588245), variant(50041518621013), variant(50041518653781), variant(50041518686549), variant(50041518719317), variant(50041518752085), variant(50041518784853)]","[option(12198238224725), option(12198238257493)]","[image(57004525191509), image(57004525322581), image(57004525486421), image(57004525453653), image(57004525551957)]",image(57004525191509)
9723741733205,CONVERSE | TODDLER CHUCK TAYLOR ALL STAR AXEL MID,"The Converse Chuck Taylor All Star Axel recasts the iconic original in a refreshed silhouette for a premium look and feel. A no-tie design lets kids slip them on and go, while a rubber outsole delivers reliable traction from the classroom to the playground.",CONVERSE,SHOES,2024-12-19T09:27:51-05:00,converse-toddler-chuck-taylor-all-star-axel-mid,2024-12-19T09:35:54-05:00,2024-12-19T09:27:51-05:00,,web,"converse, egnition-sample-data, kid",active,gid://shopify/Product/9723741733205,"[variant(50041519046997), variant(50041519079765), variant(50041519112533), variant(50041519145301), variant(50041519178069)]","[option(12198238355797), option(12198238388565)]","[image(57004525683029), image(57004525846869), image(57004525945173), image(57004526010709), image(57004526076245)]",image(57004525683029)
9723741798741,NIKE | TODDLER ROSHE ONE,"The Nike Roshe One Infant Shoe offers breathable comfort and soft yet durable cushioning with a mesh upper and Phylon midsole that doubles as an outsole. The shoe is intended to be versatile, worn with or without socks, dressed up or down, for walking or just taking it easy.",NIKE,SHOES,2024-12-19T09:27:54-05:00,nike-toddler-roshe-one,2024-12-19T09:29:05-05:00,2024-12-19T09:27:54-05:00,,web,"egnition-sample-data, kid, nike",active,gid://shopify/Product/9723741798741,"[variant(50041519309141), variant(50041519341909)]","[option(12198238454101), option(12198238486869)]","[image(57004526207317), image(57004526272853), image(57004526338389), image(57004526469461), image(57004526567765)]",image(57004526207317)
9723741897045,ADIDAS | KID'S STAN SMITH,"The Stan Smith owned the tennis court in the '70s. Today it runs the streets with the same clean, classic style. These kids' shoes preserve the iconic look of the original, made in leather with punched 3-Stripes, heel and tongue logos and lightweight step-in cushioning.",ADIDAS,SHOES,2024-12-19T09:27:56-05:00,adidas-kids-stan-smith,2024-12-19T09:35:54-05:00,2024-12-19T09:27:56-05:00,,web,"adidas, egnition-sample-data, kid",active,gid://shopify/Product/9723741897045,"[variant(50041519440213), variant(50041519472981)]","[option(12198238585173), option(12198238617941)]","[image(57004526633301), image(57004526797141), image(57004526862677), image(57004526895445), image(57004527190357)]",image(57004526633301)
9723741962581,VANS APPAREL AND ACCESSORIES | CLASSIC SUPER NO SHOW SOCKS 3 PACK WHITE,The classic super no show socks are for all your low top shoes like Classic Slip-Ons. These socks are designed to stay hidden under your shoes for an athletic look with either jeans or shorts. Thin walled breathable cotton/nylon blend.,VANS,ACCESSORIES,2024-12-19T09:27:59-05:00,vans-apparel-and-accessories-classic-super-no-show-socks-3-pack-white,2024-12-19T09:29:05-05:00,2024-12-19T09:27:59-05:00,,web,"egnition-sample-data, unisex, vans",active,gid://shopify/Product/9723741962581,[variant(50041519538517)],"[option(12198238683477), option(12198238716245)]","[image(57004527419733), image(57004527485269)]",image(57004527419733)
9723742060885,HERSCHEL | IONA,"Featuring a cinch closure concealed by a slender top flap, the Iona backpack unites everyday practicality with clean design.",HERSCHEL,ACCESSORIES,2024-12-19T09:28:00-05:00,herschel-iona,2024-12-19T09:35:55-05:00,2024-12-19T09:28:00-05:00,,web,"backpack, egnition-sample-data, herschel",active,gid://shopify/Product/9723742060885,[variant(50041519636821)],"[option(12198238814549), option(12198238847317)]","[image(57004527583573), image(57004527616341), image(57004528173397), image(57004528075093)]",image(57004527583573)
9723742159189,FLEX FIT | MINI OTTOMAN BLACK,Flexfit Mini Ottoman Cap,FLEX FIT,ACCESSORIES,2024-12-19T09:28:03-05:00,flex-fit-mini-ottoman-black,2024-12-19T09:35:55-05:00,2024-12-19T09:28:03-05:00,,web,"egnition-sample-data, flex-fit, men",active,gid://shopify/Product/9723742159189,"[variant(50041520882005), variant(50041520914773), variant(50041520947541), variant(50041520980309)]","[option(12198238978389), option(12198239011157)]","[image(57004528664917), image(57004528828757), image(57004528861525), image(57004528992597)]",image(57004528664917)
9723742224725,NIKE | SWOOSH PRO FLAT PEAK CAP,The Nike Swoosh Pro Flat Snapback features an embroidered logo for style and wool construction with an adjustable closure for a comfortable fit.,NIKE,ACCESSORIES,2024-12-19T09:28:05-05:00,nike-swoosh-pro-flat-peak-cap,2024-12-19T09:29:10-05:00,2024-12-19T09:28:05-05:00,,web,"cap, egnition-sample-data, nike",active,gid://shopify/Product/9723742224725,[variant(50041521045845)],"[option(12198239076693), option(12198239109461)]","[image(57004529090901), image(57004529189205), image(57004529385813), image(57004529549653)]",image(57004529090901)
9723742290261,ADIDAS | CLASSIC BACKPACK,"This women's backpack has a glam look, thanks to a faux-leather build with an allover fur print. The front zip pocket keeps small things within reach, while an interior divider reins in potential chaos.",ADIDAS,ACCESSORIES,2024-12-19T09:28:07-05:00,adidas-classic-backpack,2024-12-19T09:29:11-05:00,2024-12-19T09:28:07-05:00,,web,"adidas, backpack, egnition-sample-data",active,gid://shopify/Product/9723742290261,[variant(50041521111381)],"[option(12198239174997), option(12198239207765)]","[image(57004530336085), image(57004530368853), image(57004530401621)]",image(57004530336085)
9723742388565,ADIDAS | CLASSIC BACKPACK | LEGEND INK MULTICOLOUR,"The adidas BP Classic Cap features a pre-curved brim to keep your face shaded, while a hook-and-loop adjustable closure provides a comfortable fit. With a 3-Stripes design and reflective accents. The perfect piece to top off any outfit.",ADIDAS,ACCESSORIES,2024-12-19T09:28:09-05:00,adidas-classic-backpack-legend-ink-multicolour,2024-12-19T09:29:11-05:00,2024-12-19T09:28:09-05:00,,web,"adidas, backpack, egnition-sample-data",active,gid://shopify/Product/9723742388565,[variant(50041521209685)],"[option(12198239306069), option(12198239338837)]","[image(57004530565461), image(57004530598229), image(57004530696533)]",image(57004530565461)
